{"schemaVersion":"ckb-repro-environment-attestation-authority-v1","status":"planned","signingFingerprint":"","observedEnvironmentProjectionHash":"","authoritySource":"release://ckb/environment-attestation-authority-v1","authoritySourceHash":"sha256:ce2a1bf242f355edce14efb506dba15e6155c726be4e4da91e6047a129a1cc3f"}
